{
  "schemaVersion": 3,
  "risk": "full-delivery",
  "requiredLevel": "L4",
  "components": [
    "research-web",
    "unknown-boundary",
    "research-web-api",
    "research-web-ui",
    "documentation",
    "verification-system",
    "critical-chain",
    "research-web-verification"
  ],
  "platforms": [
    "generic",
    "linux",
    "macos",
    "windows",
    "cross-platform"
  ],
  "changeSummary": {
    "fileCount": 37,
    "ruleIds": [
      "research-web",
      "fallback",
      "research-web-api",
      "research-web-ui-core",
      "documentation",
      "ci",
      "critical-chain",
      "research-web-ci"
    ],
    "impactIds": [
      "research-web",
      "unknown-boundary",
      "research-web-api",
      "research-web-ui",
      "documentation",
      "verification-system",
      "critical-chain",
      "research-web-verification"
    ]
  },
  "changedFiles": [
    "app/research_web/discovery/__init__.py",
    "app/research_web/discovery/models.py",
    "app/research_web/discovery/sources.py",
    "app/research_web/discovery/handoff.py",
    "app/research_web/discovery/service.py",
    "app/research_web/discovery/tracking.py",
    "app/research_web/discovery/routes.py",
    "app/research_web/store.py",
    "app/research_web/datahub/snapshots.py",
    "app/research_web/service.py",
    "app/research_web/main.py",
    "app/research_web/automation/service.py",
    "app/research_web/multiuser/runtime.py",
    "app/research_web/multiuser/gateway.py",
    "app/research_web/ui/discovery.mjs",
    "app/research_web/ui/discovery.css",
    "app/research_web/ui/app.mjs",
    "app/research_web/ui/core.mjs",
    "app/research_web/ui/intel.mjs",
    "app/research_web/ui/index.html",
    "tests/research_web/test_discovery.py",
    "tests/research_web/test_discovery_tracking.py",
    "tests/research_web/test_discovery_routes.py",
    "tests/javascript/research_web_discovery.test.mjs",
    "docs/plans/2026-10-23-intel-discovery.md",
    "docs/research-web-discovery.md",
    "docs/ARCHITECTURE.md",
    "docs/DEVELOPMENT_MAP.md",
    "docs/architecture/research-web/02-research-runtime.md",
    "docs/architecture/research-web/03-data-files.md",
    "docs/architecture/research-web/04-api.md",
    "docs/architecture/research-web/05-security-validation.md",
    "docs/research-web-ui.md",
    "docs/research-web-installation.md",
    "docs/actions-budget.md",
    ".github/workflows/research-web-checks.yml",
    ".github/workflows/research-web-bootstrap.yml"
  ],
  "impact": [
    {
      "path": "app/research_web/discovery/__init__.py",
      "rule": "research-web",
      "reason": "research_web_change",
      "modules": [
        "research-web"
      ],
      "coupling": "low",
      "minimumLevel": "L1"
    },
    {
      "path": "app/research_web/discovery/models.py",
      "rule": "research-web",
      "reason": "research_web_change",
      "modules": [
        "research-web"
      ],
      "coupling": "low",
      "minimumLevel": "L1"
    },
    {
      "path": "app/research_web/discovery/sources.py",
      "rule": "research-web",
      "reason": "research_web_change",
      "modules": [
        "research-web"
      ],
      "coupling": "low",
      "minimumLevel": "L1"
    },
    {
      "path": "app/research_web/discovery/handoff.py",
      "rule": "research-web",
      "reason": "research_web_change",
      "modules": [
        "research-web"
      ],
      "coupling": "low",
      "minimumLevel": "L1"
    },
    {
      "path": "app/research_web/discovery/service.py",
      "rule": "research-web",
      "reason": "research_web_change",
      "modules": [
        "research-web"
      ],
      "coupling": "low",
      "minimumLevel": "L1"
    },
    {
      "path": "app/research_web/discovery/tracking.py",
      "rule": "research-web",
      "reason": "research_web_change",
      "modules": [
        "research-web"
      ],
      "coupling": "low",
      "minimumLevel": "L1"
    },
    {
      "path": "app/research_web/discovery/routes.py",
      "rule": "research-web",
      "reason": "research_web_change",
      "modules": [
        "research-web"
      ],
      "coupling": "low",
      "minimumLevel": "L1"
    },
    {
      "path": "app/research_web/store.py",
      "rule": "research-web",
      "reason": "research_web_change",
      "modules": [
        "research-web"
      ],
      "coupling": "low",
      "minimumLevel": "L1"
    },
    {
      "path": "app/research_web/datahub/snapshots.py",
      "rule": "fallback",
      "reason": "unknown_path",
      "modules": [
        "unknown-boundary"
      ],
      "coupling": "high",
      "minimumLevel": "L4"
    },
    {
      "path": "app/research_web/service.py",
      "rule": "research-web",
      "reason": "research_web_change",
      "modules": [
        "research-web"
      ],
      "coupling": "low",
      "minimumLevel": "L1"
    },
    {
      "path": "app/research_web/service.py",
      "rule": "research-web-api",
      "reason": "research_web_api_change",
      "modules": [
        "research-web-api"
      ],
      "coupling": "low",
      "minimumLevel": "L1"
    },
    {
      "path": "app/research_web/main.py",
      "rule": "research-web",
      "reason": "research_web_change",
      "modules": [
        "research-web"
      ],
      "coupling": "low",
      "minimumLevel": "L1"
    },
    {
      "path": "app/research_web/automation/service.py",
      "rule": "research-web",
      "reason": "research_web_change",
      "modules": [
        "research-web"
      ],
      "coupling": "low",
      "minimumLevel": "L1"
    },
    {
      "path": "app/research_web/multiuser/runtime.py",
      "rule": "research-web",
      "reason": "research_web_change",
      "modules": [
        "research-web"
      ],
      "coupling": "low",
      "minimumLevel": "L1"
    },
    {
      "path": "app/research_web/multiuser/gateway.py",
      "rule": "research-web",
      "reason": "research_web_change",
      "modules": [
        "research-web"
      ],
      "coupling": "low",
      "minimumLevel": "L1"
    },
    {
      "path": "app/research_web/ui/discovery.mjs",
      "rule": "research-web",
      "reason": "research_web_change",
      "modules": [
        "research-web"
      ],
      "coupling": "low",
      "minimumLevel": "L1"
    },
    {
      "path": "app/research_web/ui/discovery.css",
      "rule": "research-web",
      "reason": "research_web_change",
      "modules": [
        "research-web"
      ],
      "coupling": "low",
      "minimumLevel": "L1"
    },
    {
      "path": "app/research_web/ui/app.mjs",
      "rule": "research-web",
      "reason": "research_web_change",
      "modules": [
        "research-web"
      ],
      "coupling": "low",
      "minimumLevel": "L1"
    },
    {
      "path": "app/research_web/ui/app.mjs",
      "rule": "research-web-ui-core",
      "reason": "research_web_ui_change",
      "modules": [
        "research-web-ui"
      ],
      "coupling": "low",
      "minimumLevel": "L1"
    },
    {
      "path": "app/research_web/ui/core.mjs",
      "rule": "research-web",
      "reason": "research_web_change",
      "modules": [
        "research-web"
      ],
      "coupling": "low",
      "minimumLevel": "L1"
    },
    {
      "path": "app/research_web/ui/intel.mjs",
      "rule": "research-web",
      "reason": "research_web_change",
      "modules": [
        "research-web"
      ],
      "coupling": "low",
      "minimumLevel": "L1"
    },
    {
      "path": "app/research_web/ui/index.html",
      "rule": "research-web",
      "reason": "research_web_change",
      "modules": [
        "research-web"
      ],
      "coupling": "low",
      "minimumLevel": "L1"
    },
    {
      "path": "tests/research_web/test_discovery.py",
      "rule": "fallback",
      "reason": "unknown_path",
      "modules": [
        "unknown-boundary"
      ],
      "coupling": "high",
      "minimumLevel": "L4"
    },
    {
      "path": "tests/research_web/test_discovery_tracking.py",
      "rule": "fallback",
      "reason": "unknown_path",
      "modules": [
        "unknown-boundary"
      ],
      "coupling": "high",
      "minimumLevel": "L4"
    },
    {
      "path": "tests/research_web/test_discovery_routes.py",
      "rule": "fallback",
      "reason": "unknown_path",
      "modules": [
        "unknown-boundary"
      ],
      "coupling": "high",
      "minimumLevel": "L4"
    },
    {
      "path": "tests/javascript/research_web_discovery.test.mjs",
      "rule": "fallback",
      "reason": "unknown_path",
      "modules": [
        "unknown-boundary"
      ],
      "coupling": "high",
      "minimumLevel": "L4"
    },
    {
      "path": "docs/plans/2026-10-23-intel-discovery.md",
      "rule": "documentation",
      "reason": "documentation_only",
      "modules": [
        "documentation"
      ],
      "coupling": "low",
      "minimumLevel": "L0"
    },
    {
      "path": "docs/research-web-discovery.md",
      "rule": "documentation",
      "reason": "documentation_only",
      "modules": [
        "documentation"
      ],
      "coupling": "low",
      "minimumLevel": "L0"
    },
    {
      "path": "docs/ARCHITECTURE.md",
      "rule": "documentation",
      "reason": "documentation_only",
      "modules": [
        "documentation"
      ],
      "coupling": "low",
      "minimumLevel": "L0"
    },
    {
      "path": "docs/DEVELOPMENT_MAP.md",
      "rule": "documentation",
      "reason": "documentation_only",
      "modules": [
        "documentation"
      ],
      "coupling": "low",
      "minimumLevel": "L0"
    },
    {
      "path": "docs/architecture/research-web/02-research-runtime.md",
      "rule": "documentation",
      "reason": "documentation_only",
      "modules": [
        "documentation"
      ],
      "coupling": "low",
      "minimumLevel": "L0"
    },
    {
      "path": "docs/architecture/research-web/03-data-files.md",
      "rule": "documentation",